<?xml version="1.0" encoding="UTF-8"?>
<list xmlns="http://www.l2jfree.com" xmlns:xsi="http://www.w3.org/2001/XMLSchema-instance"
	xsi:schemaLocation="http://www.l2jfree.com ../../templates/teleport.xsd">
	<teleport id="201" description="TOI - 1st Floor" locX="115168"
		locY="16022" locZ="-5100" price="100000" isNoble="false" />
	<teleport id="202" description="TOI - 2nd Floor" locX="114649"
		locY="18587" locZ="-3609" price="150000" isNoble="false" />
	<teleport id="203" description="TOI - 3rd Floor" locX="117918"
		locY="16039" locZ="-2127" price="200000" isNoble="false" />
	<teleport id="204" description="TOI - 4th Floor" locX="114622"
		locY="12946" locZ="-645" price="250000" isNoble="false" />
	<teleport id="205" description="TOI - 5th Floor" locX="112209"
		locY="16078" locZ="928" price="300000" isNoble="false" />
	<teleport id="206" description="TOI - 6th Floor" locX="112376"
		locY="16099" locZ="1947" price="350000" isNoble="false" />
	<teleport id="207" description="TOI - 7th Floor" locX="114448"
		locY="16175" locZ="2994" price="400000" isNoble="false" />
	<teleport id="208" description="TOI - 8th Floor" locX="111063"
		locY="16118" locZ="3967" price="450000" isNoble="false" />
	<teleport id="209" description="TOI - 9th Floor" locX="117147"
		locY="18415" locZ="4977" price="500000" isNoble="false" />
	<teleport id="210" description="TOI - 10th Floor" locX="118374"
		locY="15973" locZ="5987" price="550000" isNoble="false" />
	<teleport id="211" description="TOI - 11th Floor" locX="112209"
		locY="16078" locZ="7028" price="600000" isNoble="false" />
	<teleport id="212" description="TOI - 12th Floor" locX="114809"
		locY="18711" locZ="7996" price="650000" isNoble="false" />
	<teleport id="213" description="TOI - 13th Floor" locX="115178"
		locY="16989" locZ="9007" price="700000" isNoble="false" />
	<teleport id="214" description="TOI - 14th Floor Outside Door"
		locX="112714" locY="14111" locZ="10077" price="800000" isNoble="false" />
	<teleport id="215" description="TOI - 14th Floor Inside On Roof"
		locX="113098" locY="14532" locZ="10077" price="900000" isNoble="false" />
</list>
