<?xml version="1.0" encoding="UTF-8"?>
<list xmlns="http://www.l2jfree.com" xmlns:xsi="http://www.w3.org/2001/XMLSchema-instance"
	xsi:schemaLocation="http://www.l2jfree.com ../../templates/teleport.xsd">
	<teleport id="59" description="Heine -> The Town of Giran"
		locX="83400" locY="147943" locZ="-3404" price="7600" isNoble="false" />
	<teleport id="60" description="Heine -> Giran Harbor" locX="47942"
		locY="186764" locZ="-3485" price="7100" isNoble="false" />
	<teleport id="65" description="Heine -> The Town of Dion"
		locX="15670" locY="142983" locZ="-2705" price="12000" isNoble="false" />
	<teleport id="66" description="Heine -> Field of Silence"
		locX="87691" locY="162835" locZ="-3520" price="12000" isNoble="false" />
	<teleport id="67" description="Heine -> Field of Whispers"
		locX="82192" locY="226128" locZ="-3656" price="5900" isNoble="false" />
	<teleport id="68" description="Heine -> Entrance to Alligator Islands"
		locX="115583" locY="192261" locZ="-3488" price="2100" isNoble="false" />
	<teleport id="1063" description="Heine -> Oren" locX="82956"
		locY="53162" locZ="-1495" price="50000" isNoble="false" />
	<teleport id="1064" description="Heine -> Aden" locX="146331"
		locY="25806" locZ="-2013" price="50000" isNoble="false" />
	<teleport id="1065" description="Heine -> Goddard" locX="147928"
		locY="-55273" locZ="-2734" price="83000" isNoble="false" />
	<teleport id="1066" description="Heine -> Rune" locX="43799"
		locY="-47727" locZ="-798" price="82000" isNoble="false" />
	<teleport id="1067" description="Heine -> Schuttgart" locX="87386"
		locY="-143246" locZ="-1293" price="100000" isNoble="false" />
	<teleport id="1068" description="Heine -> Gludio" locX="-12672"
		locY="122776" locZ="-3116" price="47000" isNoble="false" />
	<teleport id="1069" description="Heine -> Garden of Eva" locX="86006"
		locY="231069" locZ="-3600" price="2400" isNoble="false" />
	<teleport id="200918" description="Heine -> Isle of Prayer"
		locX="149518" locY="195280" locZ="-3736" price="7200" isNoble="false" />
</list>
