<?xml version="1.0" encoding="UTF-8"?>
<list xmlns="http://www.l2jfree.com" xmlns:xsi="http://www.w3.org/2001/XMLSchema-instance"
	xsi:schemaLocation="http://www.l2jfree.com ../templates/teleport.xsd">
	<teleport id="12196" description="Western Fortress -> Fort North Gate"
		locX="112320" locY="-17152" locZ="-992" price="0" isNoble="false" />
	<teleport id="12197" description="Western Fortress -> Fort South Gate"
		locX="110339" locY="-13257" locZ="-992" price="0" isNoble="false" />
	<teleport id="12198" description="Western Fortress -> Goddard Town Square"
		locX="147725" locY="-56517" locZ="-2775" price="0" isNoble="false" />
	<teleport id="12199" description="Western Fortress -> Goddard Town Gate"
		locX="147876" locY="-42345" locZ="-2208" price="0" isNoble="false" />
	<teleport id="12200" description="Western Fortress -> Aden Town Square"
		locX="146331" locY="25762" locZ="-2018" price="500" isNoble="false" />
	<teleport id="12201" description="Western Fortress -> Blazing Swamp"
		locX="155305" locY="-16326" locZ="-3315" price="500" isNoble="false" />
	<teleport id="12202" description="Western Fortress -> Varka Silenos Outpost"
		locX="125556" locY="-40951" locZ="-3719" price="500" isNoble="false" />
	<teleport id="12203" description="Western Fortress -> Tower of Insolence"
		locX="114642" locY="11103" locZ="-5115" price="500" isNoble="false" />
</list>
