<?xml version="1.0" encoding="UTF-8"?>
<list xmlns="http://www.l2jfree.com" xmlns:xsi="http://www.w3.org/2001/XMLSchema-instance"
	xsi:schemaLocation="http://www.l2jfree.com ../../templates/teleport.xsd">
	<teleport id="18" description="Dion Town -> Town of Gludio"
		locX="-12672" locY="122776" locZ="-3116" price="3400" isNoble="false" />
	<teleport id="19" description="Dion Town -> Town of Giran"
		locX="83400" locY="147943" locZ="-3404" price="6800" isNoble="false" />
	<teleport id="20" description="Dion Town -> Giran Harbor"
		locX="47942" locY="186764" locZ="-3485" price="6500" isNoble="false" />
	<teleport id="85" description="Dion -> Heine" locX="111409"
		locY="219364" locZ="-3545" price="12000" isNoble="false" />
	<teleport id="86" description="Dion -> Partisan Hideaway"
		locX="46467" locY="126885" locZ="-3720" price="1700" isNoble="false" />
	<teleport id="87" description="Dion -> Bee Hive" locX="20505"
		locY="189036" locZ="-3344" price="2900" isNoble="false" />
	<teleport id="350" description="Dion(artifact -> out)" locX="22967"
		locY="157715" locZ="-2954" price="0" isNoble="false" />
	<teleport id="351" description="Dion(artifact -> hall)" locX="22090"
		locY="159871" locZ="-2711" price="0" isNoble="false" />
	<teleport id="352" description="Dion(artifact -> outofcastle)"
		locX="22448" locY="155798" locZ="-2958" price="0" isNoble="false" />
	<teleport id="353" description="Dion(in -> artifact)" locX="22592"
		locY="161530" locZ="-2775" price="0" isNoble="false" />
	<teleport id="354" description="Dion(in -> out)" locX="22967"
		locY="157715" locZ="-2954" price="0" isNoble="false" />
	<teleport id="355" description="Dion(in -> outofcastle)" locX="22448"
		locY="155798" locZ="-2958" price="0" isNoble="false" />
	<teleport id="356" description="Dion(out -> artifact)" locX="22592"
		locY="161530" locZ="-2775" price="0" isNoble="false" />
	<teleport id="357" description="Dion(out -> hall)" locX="22090"
		locY="159871" locZ="-2711" price="0" isNoble="false" />
	<teleport id="358" description="Dion(out -> outofcastle)"
		locX="22448" locY="155798" locZ="-2958" price="0" isNoble="false" />
	<teleport id="359" description="Dion(outofcastle -> artifact)"
		locX="22592" locY="161530" locZ="-2775" price="0" isNoble="false" />
	<teleport id="360" description="Dion(outofcastle -> out)"
		locX="22967" locY="157715" locZ="-2954" price="0" isNoble="false" />
	<teleport id="361" description="Dion(outofcastle -> hall)"
		locX="22090" locY="159871" locZ="-2711" price="0" isNoble="false" />
	<teleport id="1046" description="Dion -> Goddard" locX="147928"
		locY="-55273" locZ="-2734" price="71000" isNoble="false" />
	<teleport id="1047" description="Dion -> Rune Castle Town"
		locX="43799" locY="-47727" locZ="-798" price="57000" isNoble="false" />
	<teleport id="1048" description="Dion -> Schuttgart" locX="87386"
		locY="-143246" locZ="-1293" price="88000" isNoble="false" />
	<teleport id="1049" description="Dion -> Aden" locX="146819" 
		locY="25806" locZ="-2013" price="52000" isNoble="false" />
	<teleport id="1050" description="Dion -> Oren" locX="82956"
		locY="53162" locZ="-1495" price="33000" isNoble="false" />
	<teleport id="1051" description="Dion -> Cruma Marshlands"
		locX="5106" locY="126916" locZ="-3664" price="760" isNoble="false" />
	<teleport id="1052" description="Dion -> Cruma Tower" locX="17192"
		locY="114178" locZ="-3439" price="2300" isNoble="false" />
	<teleport id="1053" description="Dion -> Dion Pasture" locX="630"
		locY="179184" locZ="-3720" price="1500" isNoble="false" />
	<teleport id="1054" description="Dion -> Tanor Canyon" locX="60374"
		locY="164301" locZ="-2856" price="3900" isNoble="false" />
	<teleport id="2005" description="Dion Outer -> Out" locX="22315"
		locY="156447" locZ="-2962" price="0" isNoble="false" />
	<teleport id="2006" description="Dion Outer -> In" locX="22315"
		locY="156909" locZ="-2962" price="0" isNoble="false" />
	<teleport id="2007" description="Dion Inner -> Out" locX="22073"
		locY="159057" locZ="-2725" price="0" isNoble="false" />
	<teleport id="2008" description="Dion Inner -> In" locX="22073"
		locY="159516" locZ="-2706" price="0" isNoble="false" />
	<teleport id="13008" description="Dion Castle -> Front Of Dion Castle"
		locX="17433" locY="147442" locZ="-3147" price="0" isNoble="false" />
	<teleport id="13009" description="Dion Castle -> Dion Town Square"
		locX="18643" locY="145420" locZ="-3152" price="0" isNoble="false" />
	<teleport id="13010" description="Dion Castle -> Front of the Hive Fortress"
		locX="15384" locY="182932" locZ="-3593" price="0" isNoble="false" />
	<teleport id="13011"
		description="Dion Castle -> Front of the Dragonspine Fortress" locX="14480"
		locY="90563" locZ="-3734" price="0" isNoble="false" />
	<teleport id="13012" description="Dion Castle -> Cruma Tower"
		locX="17225" locY="114173" locZ="-3440" price="500" isNoble="false" />
	<teleport id="13013" description="Dion Castle -> Plains of Dion"
		locX="630" locY="179184" locZ="-3720" price="500" isNoble="false" />
	<teleport id="13014" description="Dion Castle -> Bee Hive"
		locX="34475" locY="188095" locZ="-2976" price="500" isNoble="false" />
	<teleport id="13015" description="Dion Castle -> Tanor Canyon"
		locX="58316" locY="163851" locZ="-2816" price="500" isNoble="false" />
	<teleport id="60026" description="Dion Throne" locX="22074"
		locY="160352" locZ="-2690" price="0" isNoble="false" />
	<teleport id="60027" description="Dion Inside" locX="22150"
		locY="158042" locZ="-2873" price="0" isNoble="false" />
	<teleport id="60028" description="Dion Artefacts Room" locX="22078"
		locY="161387" locZ="-2771" price="0" isNoble="false" />
	<teleport id="60029" description="Dion Out of the Castle"
		locX="22306" locY="156027" locZ="-2953" price="0" isNoble="false" />
</list>
