<?xml version="1.0" encoding="UTF-8"?>
<list xmlns="http://www.l2jfree.com" xmlns:xsi="http://www.w3.org/2001/XMLSchema-instance"
	xsi:schemaLocation="http://www.l2jfree.com ../../templates/teleport.xsd">
	<teleport id="2" description="Elven Town  -> Town of Gludio"
		locX="-12672" locY="122776" locZ="-3116" price="9200" isNoble="false" />
	<teleport id="468" description="Elven Village -> Elven Forest"
		locX="21362" locY="51122" locZ="-3688" price="710" isNoble="false" />
	<teleport id="469" description="Elven Village -> Neutral Zone"
		locX="-10674" locY="75550" locZ="-3597" price="740" isNoble="false" />
	<teleport id="470" description="Elven Village -> Elven Fortress"
		locX="29294" locY="74968" locZ="-3776" price="820" isNoble="false" />
	<teleport id="1013" description="Elven Village -> Neutral Zone"
		locX="-10674" locY="75550" locZ="-3597" price="1700" isNoble="false" />
	<teleport id="1014" description="Elven Village -> Dwarven Village"
		locX="115113" locY="-178212" locZ="-901" price="23000" isNoble="false" />
	<teleport id="1015" description="Elven Village -> TI Village"
		locX="-84318" locY="244579" locZ="-3730" price="23000" isNoble="false" />
	<teleport id="1016" description="Elven Village -> Orc Village"
		locX="-44836" locY="-112524" locZ="-235" price="18000" isNoble="false" />
	<teleport id="12053" description="Elven Village -> Kamael Village"
		locX="-117251" locY="46771" locZ="360" price="16000" isNoble="false" />
</list>
