<?xml version="1.0" encoding="UTF-8"?>
<list xmlns="http://www.l2jfree.com" xmlns:xsi="http://www.w3.org/2001/XMLSchema-instance"
	xsi:schemaLocation="http://www.l2jfree.com ../../templates/teleport.xsd">
	<teleport id="42" description="Hunter's Village -> Giran Town"
		locX="83400" locY="147943" locZ="-3404" price="9400" isNoble="false" />
	<teleport id="43" description="Hunter's Village -> Oren Town"
		locX="82956" locY="53162" locZ="-1495" price="4100" isNoble="false" />
	<teleport id="44" description="Hunter's Village -> Ivory Tower"
		locX="85348" locY="16142" locZ="-3699" price="8200" isNoble="false" />
	<teleport id="45" description="Hunter's Village -> Hardin's Private Academy"
		locX="105918" locY="109759" locZ="-3207" price="3400" isNoble="false" />
	<teleport id="46" description="Hunter's Village -> Aden Town"
		locX="146819" locY="25806" locZ="-2013" price="5900" isNoble="false" />
	<teleport id="99" description="Hunters -> Northern Pathway of Enchanted Valley"
		locX="104426" locY="33746" locZ="-3800" price="3600" isNoble="false" />
	<teleport id="100" description="Hunters -> Southern Pathway of Enchanted Valley"
		locX="124904" locY="61992" locZ="-3920" price="1300" isNoble="false" />
	<teleport id="101" description="Hunters -> Entrance to the Forest of Mirrors"
		locX="142065" locY="81300" locZ="-3000" price="2000" isNoble="false" />
	<teleport id="102" description="Hunters -> The Front of Anghel Waterfall"
		locX="163341" locY="91374" locZ="-3320" price="4000" isNoble="false" />
</list>
