<?xml version="1.0" encoding="UTF-8"?>
<list xmlns="http://www.l2jfree.com" xmlns:xsi="http://www.w3.org/2001/XMLSchema-instance"
	xsi:schemaLocation="http://www.l2jfree.com ../../templates/teleport.xsd">
	<teleport id="22" description="Cruma Tower 1st floor -> Cruma Tower Entrance"
		locX="17192" locY="114178" locZ="-3439" price="0" isNoble="false" />
	<teleport id="23" description="Cruma Tower 1st floor -> Cruma Tower 2nd floor"
		locX="17776" locY="108288" locZ="-9056" price="0" isNoble="false" />
	<teleport id="24" description="Cruma Tower 2nd floor -> Cruma Tower 1st floor"
		locX="17724" locY="114004" locZ="-11667" price="0" isNoble="false" />
	<teleport id="55" description="Cruma level 2 -> Cruma level 3"
		locX="17719" locY="115590" locZ="-6584" price="0" isNoble="false" />
	<teleport id="56" description="Cruma level 3 -> Cruma Core"
		locX="17691" locY="111726" locZ="-6583" price="0" isNoble="false" />
	<teleport id="57" description="Cruma core -> Cruma level 3"
		locX="17719" locY="115590" locZ="-6584" price="0" isNoble="false" />
	<teleport id="58" description="Cruma Tower 3rd floor -> Cruma Tower 2nd Floor"
		locX="17731" locY="119465" locZ="-9067" price="0" isNoble="false" />
</list>
